{
  "attempt_id": "provider-attempt-fixture",
  "bridge_pattern": "none",
  "duration_ms": 0,
  "effective_model": "unknown",
  "effective_model_policy": "required_exact_match",
  "evidence_path": "__STATE_ROOT__/provider-evidence/run-waiting-human-timeout/review-provider-evidence.json",
  "evidence_version": "1",
  "intended_model": "claude-sonnet-4-6",
  "model_assurance": "exact_match_enforced",
  "outcome": "provider_timeout",
  "provider": "claude_headless",
  "provider_adapter_id": "claude_headless_p0",
  "provider_request_id": "provider-fixture",
  "provider_session_id": "session-run-waiting-human-timeout",
  "provider_target": "claude_headless",
  "raw_transcript_policy": "signal_only_not_shared",
  "reason_class": "provider_timeout",
  "request_id": "req-waiting-human-timeout",
  "role_definition_digest": "sha256:2c77985d85b908b7c62a69886fb2a1ea3e2a51a651df6b36c8e48112976b623c",
  "role_definition_path": "organization/roles/tech-reviewer/skill.md",
  "run_id": "run-waiting-human-timeout",
  "step_id": "review",
  "surface_metadata": {
    "async_callback_supported": false,
    "surface": "claude_headless_cli"
  },
  "timed_out": true,
  "transcript_path": "__STATE_ROOT__/provider-evidence/run-waiting-human-timeout/review-provider-transcript.json",
  "transcript_sha256": "sha256:40e1a40f84b66ab2ebf2dee86f551d3ae9633c1fe7b3d8becbdf98835f0f66b9",
  "transport": "headless_cli",
  "usage": {},
  "workflow_id": "single_step_external_review"
}
